{
  "config_id": "ERL-RECURRING-DISCOVERY-BASELINE-001",
  "enabled": true,
  "cadence": {
    "frequency": "daily",
    "interval": 1,
    "timezone": "America/Chicago"
  },
  "scope": {
    "topics": [
      "executive rhetoric",
      "federal enforcement",
      "constitutional and civil-rights accountability"
    ],
    "time_window": "rolling-14-days-with-historical-links",
    "jurisdictions": [
      "United States federal"
    ],
    "actors": [
      "President",
      "Attorney General",
      "DHS Secretary",
      "FBI Director"
    ],
    "agencies": [
      "Department of Justice",
      "Federal Bureau of Investigation",
      "Department of Homeland Security",
      "Immigration and Customs Enforcement"
    ]
  },
  "source_classes": [
    "primary-legal-record",
    "official-government",
    "court-record",
    "legislative-oversight",
    "local-reporting",
    "national-reporting",
    "advocacy-record"
  ],
  "searches": [
    {
      "search_id": "captured-topic-refresh",
      "query_template": "Refresh existing ledger topics for new official actions, corrections, litigation, oversight, measurable outcomes, and evidence that strengthens, weakens, or disambiguates unresolved DPOI state.",
      "discovery_class": "captured-topic-refresh",
      "priority": "critical",
      "enabled": true,
      "dpoi_search_parameters": {
        "evidence_directions": [
          "strengthen",
          "weaken",
          "disambiguate"
        ],
        "strengthen_terms": [
          "confirmed",
          "corroborated",
          "substantiated",
          "admitted",
          "verified",
          "consistent with"
        ],
        "weaken_terms": [
          "retracted",
          "dismissed",
          "contradicted",
          "unsubstantiated",
          "no evidence",
          "incorrect"
        ],
        "disambiguation_terms": [
          "timeline",
          "chronology",
          "authority",
          "jurisdiction",
          "scope",
          "definition",
          "records",
          "testimony",
          "metadata"
        ],
        "state_dimensions": [
          "current-evidence-state",
          "authority",
          "timeline",
          "identity",
          "causation",
          "scope"
        ],
        "no_result_effect": "no-update",
        "candidate_only": true
      }
    },
    {
      "search_id": "new-federal-enforcement-incidents",
      "query_template": "Find newly reported federal enforcement incidents involving use of force, detention, constitutional claims, changes to investigative responsibility, and evidence capable of strengthening, weakening, or clarifying related DPOIs.",
      "discovery_class": "new-incident",
      "priority": "high",
      "enabled": true,
      "dpoi_search_parameters": {
        "evidence_directions": [
          "strengthen",
          "weaken",
          "disambiguate"
        ],
        "strengthen_terms": [
          "confirmed",
          "charged",
          "filed",
          "documented",
          "body camera",
          "official record"
        ],
        "weaken_terms": [
          "cleared",
          "dismissed",
          "misidentified",
          "false report",
          "no violation",
          "not involved"
        ],
        "disambiguation_terms": [
          "incident report",
          "agency responsibility",
          "jurisdiction",
          "sequence",
          "timestamp",
          "identity",
          "chain of command"
        ],
        "state_dimensions": [
          "identity",
          "authority",
          "timeline",
          "jurisdiction",
          "conduct",
          "outcome"
        ],
        "no_result_effect": "no-update",
        "candidate_only": true
      }
    },
    {
      "search_id": "accountability-chain-contradictions",
      "query_template": "Find evidence that confirms or contradicts public statements, internal guidance, agency practice, court records, congressional oversight, later implementation, and unresolved DPOI assumptions; prioritize records that disambiguate who knew, decided, directed, executed, or retained custody.",
      "discovery_class": "contradiction-discovery",
      "priority": "high",
      "enabled": true,
      "dpoi_search_parameters": {
        "evidence_directions": [
          "strengthen",
          "weaken",
          "disambiguate"
        ],
        "strengthen_terms": [
          "corroborated",
          "consistent",
          "confirmed",
          "matches",
          "authenticated",
          "under oath"
        ],
        "weaken_terms": [
          "contradiction",
          "inconsistent",
          "recanted",
          "corrected",
          "disputed",
          "unsupported"
        ],
        "disambiguation_terms": [
          "who authorized",
          "who directed",
          "who executed",
          "who knew",
          "custodian",
          "delegation",
          "email metadata",
          "records retention"
        ],
        "state_dimensions": [
          "authority",
          "knowledge",
          "execution",
          "records-custody",
          "channel-purpose",
          "timeline"
        ],
        "no_result_effect": "no-update",
        "candidate_only": true
      }
    },
    {
      "search_id": "historical-accountability-controls",
      "query_template": "Find historical controls and precedents for comparable enforcement, civil-rights investigation, agency self-investigation, executive intervention, and DPOI-relevant alternative explanations that can strengthen, weaken, or disambiguate the current interpretation.",
      "discovery_class": "control-discovery",
      "priority": "medium",
      "enabled": true,
      "dpoi_search_parameters": {
        "evidence_directions": [
          "strengthen",
          "weaken",
          "disambiguate"
        ],
        "strengthen_terms": [
          "precedent",
          "same pattern",
          "repeated",
          "consistent practice",
          "historical match"
        ],
        "weaken_terms": [
          "exception",
          "different authority",
          "different procedure",
          "noncomparable",
          "changed policy"
        ],
        "disambiguation_terms": [
          "historical control",
          "baseline",
          "standard practice",
          "policy in force",
          "authority at time",
          "comparison period"
        ],
        "state_dimensions": [
          "baseline",
          "alternative-explanation",
          "policy-context",
          "authority",
          "timeline",
          "comparability"
        ],
        "no_result_effect": "no-update",
        "candidate_only": true
      }
    },
    {
      "search_id": "white-house-press-access-precedent",
      "query_template": "Find new primary executive statements, White House credential or press-pool actions, written access criteria, outlet/WHCA responses, court filings and orders, corrections, implementation changes, and historical controls relevant to White House press access, freedom of the press, viewpoint discrimination, procedural safeguards, and cross-administration reuse.",
      "discovery_class": "captured-topic-refresh",
      "priority": "critical",
      "enabled": true,
      "dpoi_search_parameters": {
        "evidence_directions": [
          "strengthen",
          "weaken",
          "disambiguate"
        ],
        "strengthen_terms": [
          "credential revoked",
          "access denied",
          "written criteria",
          "court order",
          "injunction",
          "hard pass",
          "press pool",
          "implemented"
        ],
        "weaken_terms": [
          "rescinded",
          "restored access",
          "not implemented",
          "narrowed",
          "vacated",
          "reversed",
          "superseded"
        ],
        "disambiguation_terms": [
          "hard pass",
          "briefing room",
          "East Room",
          "press pool",
          "Oval Office",
          "Air Force One",
          "restricted workspace",
          "viewpoint",
          "procedure",
          "written reason",
          "appeal",
          "administration"
        ],
        "state_dimensions": [
          "implementation",
          "access-surface",
          "viewpoint",
          "procedure",
          "precedent",
          "cross-administration-symmetry",
          "timeline"
        ],
        "no_result_effect": "no-update",
        "candidate_only": true
      }
    }
  ],
  "review_boundary": {
    "automation_may_propose": true,
    "automation_may_publish": false,
    "required_review_states": [
      "candidate-generated",
      "source-posture-reviewed",
      "ledger-review-required"
    ]
  },
  "notes": "Automation creates discovery candidates only. Directional DPOI parameters identify potentially strengthening, weakening, or disambiguating evidence for review; they do not change a DPOI state automatically, and a zero-result search produces no evidentiary update."
}
